id,term,description,source,collected_date
343,생활질환,"아토피 피부염, 중이염, 급성 부비동염, 만성 부비동염",KNIA,2025-08-14 12:21:26
915,선급,선급협회가 정한 선박의 구조 및 의장의 규격에 적격 한 선박에 선급협회에서 부여하는 인정증거,KIDI_BIGIN,2025-08-13 17:23:19
706,선급협회,"선박을 검사해서 정해진 규격에 따라 선박의 등급을 매겨 등록하는 기관이다. 선급협회에서는 선박목록에 선박의 명세를 기재, 공표하여 해상보험자, 하주 등에게 편의를 제공하고 있다. 세계의 주요 선급협회로서, (영국), (프랑스), (이태리), (미국), (노르웨이), (서독), (한국), (일본), (소련), (폴란드)가 있다.",KIDI_BIGIN,2025-08-13 17:23:11
708,선납보험료,생명보험이나 손해보험의 장기보험계약에서 보험료 납입방법이 일시납이 아닌 경우 보험기간의 중도에서 미경과기간의 보험료를 일괄납입하는 것을 말한다. 이 경우 보험회사는 일정한 이율로써 할인한 금액을 받아 들이며 회사소정의 이율을 붙여 적립하고 보험료 납입기일 도래시마다 그 보험료를 충당시킨다. 피보험자가 사고로 인하여 계약이 소멸되었을 경우 선납보험료의 잔액이 있으면 보험계약자에게 환급한다.,KIDI_BIGIN,2025-08-13 17:23:11
264,선납보험료 / /,"생명보험이나 손해보험의 장기보험계약에서 보험료 납입방법이 일시납이 아닌 경우 보험기간의 중도에서 미경과기간의 보험료를 납입할 경우의 보험료를 말한다. 이 경우 보험회사는 일정한 이율로 할인한 금액으로 받아들이며, 회사소정의 이율을 붙여 적립하고 보험료 납입기일 도래시마다 그 보험료를 충당시킨다. 피보험자가 사고로 인하여 계약이 소멸되었을 경우 선납보험료의 잔액이 있으면 보험계약자에게 환급한다.",DB생명,2025-08-14 13:18:54
344,선납보험료 [영 : ],생명보험이나 손해보험의 장기보험계약에서 보험료 납입방법이 일시납이 아닌 경우 보험기간의 중도에서 미경과기간의 보험료를 일괄납입하는 것을 말한다. 이 경우 보험회사는 일정한 이율로써 할인한 금액을 받아 들이며 회사소정의 이율을 붙여 적립하고 보험료 납입기일 도래시마다 그 보험료를 충당시킨다.,KNIA,2025-08-14 12:21:26
709,선단요율,"여러 선박이 동일선주의 관리하에 있는 선박은 그 선단을 구성하는 선박의 성능, 보험가액의 고저, 그 선단의 과거의 보험성적, 전반의 보험성적, 용도 항해구역 선주의 관리상태를 감안하여 요율이 책정된다. 이를 선단요율 이라 한다. 이 방법은 선박보험에 있어서 가장 이상적인 요율산출방식이라 인정되고 있다.",KIDI_BIGIN,2025-08-13 17:23:11
345,선루프,내부 환기와 탁 트인 개방감 등 쾌적한 운전에 도움을 주기 위해 자동차 지붕에 설치하는 보조 창틀,KNIA,2025-08-14 12:21:26
710,선명등미상보험증권,"영국 해상보험법 제29조에 규정되어 있는 용어로, 총괄적 문언으로 보험계약을 기술하고 선명 및 기타의 명세를 후일에 확정 통지토록 정한 보험증권을 말한다. 해상적하보험에 있어서, 선적마다 일일이 보험계약을 체결하는 번거로움을 없애고자 고안된 것으로, 예정보험계약의 일종이다. 확정통지된 금액의 합계액이 그 보험증권의 금액에 달한 때에, 이 증권의 유효기간은 종료된다. → 예정보험",KIDI_BIGIN,2025-08-13 17:23:11
916,선박건조보험(,"선박의 건조공사기간 중에 조선소 구내에서의 화재, 홍수, 전복 등의 육상 위험 또는 진수, 시운전시의 침몰, 좌초, 충돌 등의 해상위험에 의해서 선체, 기관 및 이들의 조선 재료에 생긴 손해를 보상하는 보험이다.",KIDI_BIGIN,2025-08-13 17:23:19
713,선박기간보험,"가동 중의 선박을 대상으로 해 보험기간을 정해서(통상 1년간) 인수되는 보험이며, 선박이 항해중(정박도 포함)에 해상위험으로 말미암아 생긴 손해를 보상한다. 이 보험의 대표적인 약관으로는 영국약관인 협회선박기간보험약관(, )이 있다.",KIDI_BIGIN,2025-08-13 17:23:12
716,선박보험,"선박보험은 화물선, 유조선, 여객선, 예인선, 어선 등 통상 선박이라고 불리우는 것을 비롯하여 작업선, 전마선 또는 해저석유자원 개발에 사용되는 해양굴착장치 등 해상에서 사용되어 해상 위험에 접하고 있는 것의 모든 물건을 보험의 대상으로 하며, 해상 위험(침몰, 좌초, 화재, 충돌 등)과 특약이 있는 경우에는 육상 위험에 의해서 이런 것들에게 생기는 손해를 보상하는 보험의 총칭이다. 보험종류로는 기간보험, 항해보험, 계선보험, 건조보험, 부가동손실 보험, 전쟁보험 등이 있다.",KIDI_BIGIN,2025-08-13 17:23:12
718,선박보험 특별약관(,"선박보험에서도 해상적하보험의 경우와 같이 보상의 범위에 관한 몇가지의 기본적형이 있으며 각각 특별약관이 있다. ..., ... . ..., ... , ...... , ... , ... ∼, 및 3%의 단독해손담보등의 종류가 있다. 이 외에도 선비보험, 운송임, 용선료의 기간보험, 건조보험, 수선보험, 계선보험, 기타에 관한 특별약관 또는 전쟁보험, 수뇌위험을 담보하는 특별약관이 있다. 그리고 선박의 기간보험에서 선박의 항행범위를 한정하는 항로한정의 규정도 특별약관의 일종이라고 할 수 있을 것이다.",KIDI_BIGIN,2025-08-13 17:23:12
720,선박불가동 손실보험(,"선박이 해난사고로 말미암아 가동불능이 되었을 경우에, 선박 소유자가 그 선박의불가동기간 중에 입는 경제적 손실을 보상하는 보험. 이 보험의 인수액은 선박의 경상비, 정기용선되고 있는 선박에 있어서는 정기용선료, 화주의 장기적하보증을 받고 있는 선박에 있어서는 운임수입을 기초로 해서 정해진다.",KIDI_BIGIN,2025-08-13 17:23:12
721,선박수리보험,"선박의 수리 또는 개조공사기간 중에 육상 위험 또는 해상 위험으로 말미암아 선박에 생긴 손해를 보상하는 보험. 이 보험의 계약자, 피보험자는 다 같이 선박소유자이다.",KIDI_BIGIN,2025-08-13 17:23:12
726,선박수리비보험,"선박의 수리 또는 개조공사 기간중에 선박 또는 선박의 수리재료에 육상위험 또는 해상위험에 의한 사고가 발생함으로써 입은 손해, 즉 사고발생시까지의 수리재료비, 공임, 그밖의 비용에 대한 손해를 보상하는 보험이다.",KIDI_BIGIN,2025-08-13 17:23:12
917,선박수리자 배상 책임보험(,"선박의 수리의뢰자(선박소유자 또는 선박임차인)로부터 의뢰받은 수리공사간 중에 생긴 선박, 적하, 제3자의 재물의 손괴, 또는 수리공사의 불량으로 인해 수리 공사 종료후에 생긴 선박, 적하의 손괴에 대해 선박수리업자(조선소)가 법률상의 손해 배상책임을 부담함으로써 입는 손해를 보상하는 보험을 말하며, 우리나라에서는 영업배상책임 보험의 특약으로 인수하기도 한다. 이 보험의 대상이 되는 손괴는 수리공사 기간 중 또는 수리공사 기간 종료 후 90일 이내에 발견된 것에 한정되어 있다",KIDI_BIGIN,2025-08-13 17:23:19
729,선박이익손실보험,"선주 또는 용선자 등이 용선계약 또는 재용선 계약 등을 통하여 얻을 이익이 본선의 해난사고에 따른 전손에 의해서 상실할 위험을 인수하는 보험. 본선이 전손된 경우 장래의 상실이익을 보험의 목적으로 하는 점에서, 선박 불가동 손실보험과 내용을 달리하고 있다.",KIDI_BIGIN,2025-08-13 17:23:12
731,선박전쟁보험,"전쟁위험으로 말미암아 선박에 생긴 손해를 보상하는 보험으로 통상의 해상위험을 담보하는 보험계약과는 별개의 계약으로 간주된다. 전쟁위험이란 전쟁기간의 변란, 수뢰 기타의 폭발물과의 접촉 또는 그것들의 폭발, 나포, 포획, 억류, 노동쟁의나 정치, 사회소요 등의 위험을 말한다. 우리나라에선 영국의 , 으로 인수하고 있다.",KIDI_BIGIN,2025-08-13 17:23:12
732,선박충돌 손해배상 책임약관,"피보험 선박이 다른 선박과 충돌함으로써, 다른 선박 또는 그 선박의 적하에 입힌 손해에 대하여, 피보험자가 법률상의 손해배상책임을 부담하게 된 경우의 배상금 전액을 보험금액을 한도로 해서 보상하기로 규정한 특별조항이다. 우리 나라에서 사용하고 있는 협회 선박기간보험약관(, )에서는 보상의 대상을 다른 선박 또는 그 선상의 재물로 하고, 보상금액을 배상금의 4분의 3, 그리고 보상한도액을 보험금액의 4분의 3으로 하고 있다.",KIDI_BIGIN,2025-08-13 17:23:12
734,선비보험,"선비란 식료, 연료 등 운항에 소요되는 비용의 총칭인데, 이러한 것들은 선박이 침몰 등으로 말미암아 전손에 이르렀을 경우, 선박과 함께 소멸되므로 선박과 마찬가지로 보험의 대상이 된다. 이러한 비용을 피보험이익으로 하는 것이 본래의 선비보험이지만, 현재 실무에 있어서의 선비보험은 선박기간보험을 보완하는 것으로 취급되고 있다. 즉 보험금액을 선박보험가액의 일정비율로 한정하여, 여기에 대해서는 피보험이익의 명세 제시를 요구함이 없이 전손만을 보상하는 조건으로, 저렴한 보험료로 인수되고 있다.",KIDI_BIGIN,2025-08-13 17:23:12
346,선비증액보험 [영 : - ],"선박보험에 있어서 선박의 가액은 보험기간 내에도 선박의 시장가액이 시황에 따라 급격하게 변동하고 있어 보험계약체결 시 보험자와 피보험자간에 선박가액을 협정하여, 보험기간 내 가액의 변동에도 불구하고 협정된 보험가액으로 인정하여 모든 보험금 지급의 기준으로 삼는다. 그러나, 손해방지비용, 구조비와 공동해손분담금은 선체보험의 협정가액을 기준으로 하지 않고 정상가액을 기준",KNIA,2025-08-14 12:21:26
265,선임계리사 / /,보험계리에 관한 업무를 최종적으로 검증하고 확인하는 자를 말한다.,DB생명,2025-08-14 13:18:54
347,선적지연 [영 : ],"약정품의 선적이 매매계약에서 규정된 선적기일까지 완료되지 않는 것을 말한다. 매도인의 고의, 과실 또는 태만에 의하여 지적이 된 경우에는 매도인이 책임을 져야 한다. 그러나 지적이 천재지변, 파업등과 같은 불가항력에 의한 경우에도 매도인은 수출국주재 수입국 영사관 또는 상공회의소가 발행한 증명서를 증거로 하여 선적기한의 자동연장, 선적의 유예 또는 선적의무의 면제 또는 해약을 주장할 수 있다.",KNIA,2025-08-14 12:21:26
736,선주배상 책임보험,피보험자가 소유 ̇사용 또는 관리하는 선박에 의하여 운송하는 여객이 우연한사고로 신체장애를 입은 경우의 법적 배상책임을 담보하는 배상책임보험의 하나.,KIDI_BIGIN,2025-08-13 17:23:12
348,선주배상책임보험(유도선사업자배상책임보험),"선박으로 여객운송 중 발생한 사고로 여객에게 입힌 손해를 담보하는 보험(해운업의 적용을 받는 선박소유자, 유·도선사업자(의무보험))",KNIA,2025-08-14 12:21:26
738,선주책임 상호보험,"선박 소유자 또는 운항자가 선박의 소유, 운항에 수반된 법률상의 손해배상책임을 부담하게 되거나, 비용의 지출이 불가피하게 됨으로써 입는 손해를 보상하는 보험. 구체적으로는 <제3자에 대한 선박소유자 또는 운항자로서의 책임과 선원에 대한 고용주로서의 책임> 그리고 <화주에 대한 운항업자로서의 책임>에 의거한 손해를 보상한다. 또한 충돌약관에 의한 배상의 1/4을 담보하고 생명구조비도 담보한다. 이 보험은 일반보험회사가 아닌 선주책임상호보험조합 즉, & 에 가맹함으로써 담보된다.",KIDI_BIGIN,2025-08-13 17:23:12
349,선주책임상호보험조합 [영 : : - ],"선박의 소유 및 운항에 따라 선주 또는 용선자에게 발생하는 손해 및 배상책임은 다양하기 때문에 일반의 선박보험만으로는 모두 커버할 수 없다. 예를 들면 선박 이외의 화물에 대한 충돌손해배상책임, 난파선 제거비용, 선원의 사상에 대한 배상책임 및 비용, 선하증권의 면책조항에 해당되지 않는 배상책임 등은 모두 선박보험의 대상이 되지 못한다. 이처럼 선박의 소유와 운항에 관",KNIA,2025-08-14 12:21:26
350,선체보험 [영 : - ],"흔히 선박보험이라 함은 이 선체보험을 의미한다. 선체 그 자체뿐만 아니라 모든 선박자재, 의장품, 기관과 항해용구 및 기타 비품들을 포함하는 선박을 피보험목적물로 하여 보험기간 중에 담보위험에 근인되어 발생된 피보험선박의 물적손실 및 비용손해와 충돌사고가 발생한 경우에 상대선박에 지급해야 하는 법적 충돌배상책임을 담보한다. 기본이 되는 보험 종목으로서 특별한 경우를 제외하고는 1년 단위로 계약한다",KNIA,2025-08-14 12:21:26
266,선택기간 / /,"생명보험에 가입한 직후 일정 연령의 집단은 의학적 진단, 모집인의 관찰 등에 의하여 선택된 피보험 집단이다. 이러한 집단의 사망률은 수년 전에 생명보험에 가입한 현재의 동일 연령 집단의 사망률보다 낮은 비율로 나타나는 것이 보통이다. 그 이유는 전자가 건강체만으로 구성되어 있는데 비하여 후자에는 약체화된 비건강체도 포함되어 있기 파문이다. 이렇게 선택효과를 나타내는 기간을 선택기간이라고 하며 통상 3∼5년 정도로 본다.",DB생명,2025-08-14 13:18:54
267,선택의 유효기간 (구 선택효과) / 의 /,"생명보험회사는 계약에 즈음해서 각종의 선택을 하는 데 이 때 피보험자 집단을 보험연도별로 구분해서 사망률을 비교하면 일반적으로 보험연도가 새로울수록 사망률이 낮게 되며, 이 현상을 선택효과라고 한다. 보험연도가 경과하면 사망률이 거의 일정하게 되지만 계약 당초의 사망률이 낮은 기간을 선택의 유효기간이라고 한다. 선택의 유효기간은, 6년부터 15년이라고 말하고 있으며, 선택효과가 장기간에 걸치는 일도 있다. 의사 취급과 고지서 취급을 비교한 경우, 의사 취급쪽의 선택효과를 인정할 수 있어서, 이것을 조사효과라고도 한다.",DB생명,2025-08-14 13:18:54
745,선택의유효기간(의),선택효과,KIDI_BIGIN,2025-08-13 17:23:13
741,선택표,"보험회사는 생명보험계약을 체결할 때에 의학적 진단을 비롯한 각종의 선택을 하기 때문에 계약 체결 후의 경과연수에 따라 여러 정도로 이 선택의 효과가 잔존해서, 피보험자 단체의 각 연령자의 사망률에 영향을 미친다. 그러나 이 선택의 효과는 기간이 경과함에 따라 희박해져, 어느 일정연수가 경과한 뒤에는 큰 차이는 볼 수 없게된다. 이 점을 고려해서 연령별 이외에 경과연수별로 각 연령마다의 사망률을 조사하여 작성한 사망표를 선택표라고 한다.",KIDI_BIGIN,2025-08-13 17:23:13
160,선택표,"보험회사는 생명보험계약을 체결할 때에 의학적 진단을 비롯한 각종의 선택을 하기 때문에 계약 체결 후의 경과연수에 따라 여러 정도로 이 선택의 효과가 잔존해서, 피보험자(보험대상자) 단체의 각 연령자의 사망률에 영향을 미친다. 그러나 이 선택의 효과는 기간이 경과함에 따라 희박해져, 어느 일정연수가 경과한 뒤에는 큰 차이는 볼 수 없게된다. 이 점을 고려해서 연령별 이외에 경과연수별로 각 연령마다의 사망률을 조사하여 작성한 사망표를 선택표하고 한다.",한화생명,2025-08-14 14:29:51
268,선택표 / /,"보험회사는 생명보험계약을 체결할 때에 의학적 진단을 비롯한 각종의 선택을 하고 계약 체결 후 경과 연수에 따라 여러 정도로 이 선택의 효과가 잔존해서, 피보험자 단체의 각 연령자의 사망률에 영향을 미친다. 선택의 효과는 기간이 경과함에 따라 희박해진다. 이 점을 고려해서 연령별 이외에 경과연수별로 각 연령마다의 사망률을 조사하여 작성한 사망표를 선택표라고 한다.",DB생명,2025-08-14 13:18:54
743,선택효과,"생명보험회사는 계약에 즈음해서 각종의 선택을 함으로, 피보험자집단을 보험 연도별로 구분해서 사망률을 비교하면 일반적으로 보험연도가 새로울수록 사망률이 낮다. 이 현상을 선택효과라고 한다. 보험연도가 경과하면 사망률이 거의 일정하게 되지만 계약당초의 사망률이 낮은 기간을 선택의 유효기간이라고 한다. 선택의 유효기간은, 6년부터 15년이라고 말하고 있으며, 선택효과가 장기간에 걸치는 일도 있다. 의사취급과 고지서취급을 비교한 경우, 의사취급쪽의 선택효과를 인정할 수 있어서, 이것을 조사효과라고도 한다.",KIDI_BIGIN,2025-08-13 17:23:13
351,선하증권 [영 : : /],"/ 이라고도 부른다. 정기선에 의한 개품운송의 경우에는 하나의 선박회사와 불특정다수의 하주 사이에 계약이 짧은 기간동안에 체결된다. 또한 현실적으로 운송을 하는 것은 한 척의 선박이기 때문에 각 하주마다 각각 따로 계약조건을 체결하는 것은 시간적으로나 물리적으로 도저히 불가능하다. 이러한 이유 때문에 계약조건은 선박회사가 미리 일정한 조건을 인쇄해 놓고, 선적을 신청하는 하주는 그 조건을 포괄적",KNIA,2025-08-14 12:21:26
352,선하증권약관 [영 : ],"/ 선박회사와 하주와의 사이의 운송조건을 성문화한 것으로서 통상 선하증권의 이면에 인쇄 또는 부기되어 있는 운송계약 약관 즉, 선주면책약관을 말한다. 운송품의 종류, 내용상태, 중량, 용적 등에 대해서는 책임을 지지 않는다고 기재한 부지약관과 일반면책약관 이 그 주요 골자이다.",KNIA,2025-08-14 12:21:26
269,설계사 / /,"보험설계사라 함은 「소속된 보험사업자를 위하여 보험계약을 중개하는 자로서 보험업법의 규정에 의하여 등록된 자」를 말한다. 보험설계사의 기능과 법률상 지위에 관하여는 보험계약법상, 보험업법상, 근로기준법상으로 나누어 볼 수 있다. 먼저 보험계약법상의 지위를 살펴보면, 보험모집인에게는 회사를 대리하여 보험계약 청약의 의사표시를 수령할 권한이 부여되어 있지 않으므로 보험계약의 체결에는 하등의 권한이 없다. 따라서 계약전 알릴의무의 수령권이 인정되지 아니한다고 보고있다. 보험업법상에는 보험설계사는 소속보험사업자를 위하여 보험모집을 할 수 있는 자의 위치에 있으며, 보험설계사가 모집활동을 함에 있어서 보험계약자에게 가한 손해에 대하여 보험자에게 손해배상책임을 부담하게 하고 있다. 근로기준법상의 지위를 보면 보험설계사와 소속 보험사업자와의 관계가 고용관계인지 또는 위탁계약관계인지에 관하여는 논란이 많다. 통상 보험설계사는 보험사업자와 보험계약의 체결을 중개할 것을 약정하고 그 반대급부로서 수당을 지급하는 위탁계약관계라고 보는 것이 일반적인 견해이다.",DB생명,2025-08-14 13:18:54
270,설계사 수당 / /,"보험설계사에게 모집에 대한 대가로서 지급되는 보수. 생명보험 설계사 수당지급체계는 고정성 수당과 비례성 수당으로 이원화되어 있으며, 설계사 수당의 지급방법은 회사의 자율규정에 따른다.",DB생명,2025-08-14 13:18:54
746,설계판매,생명보험 상품을 구매하려는 고객에게 그 가정의 생활조건에 알맞는 생활설계에 대한 정보를 제공하고 그것에 맞는 보험상품을 권유하여 판매하는 방법을 말한다.,KIDI_BIGIN,2025-08-13 17:23:13
271,설계판매 / /,생명보험 상품을 구매하려는 고객에게 그 가정의 생활조건에 알맞은 생활설계에 대한 정보를 제공하고 그것에 맞는 보험상품을 권유하여 판매하는 방법을 말한다.,DB생명,2025-08-14 13:18:54
748,성인병특약,"생명보험계약에 부가하는 특약의 일종. 이 특약을 부가하면 암, 당뇨병, 고혈압성 질환, 심장질환, 뇌혈관질환 등 성인병 가운데 정해진 대상요인으로 인한 입원, 수술에 대해서 급부금이 지급된다.",KIDI_BIGIN,2025-08-13 17:23:13
272,성인병특약 / /,"생명보험계약에 부가하는 특약의 일종으로, 암, 당뇨병, 고혈압성 질환, 심장질환, 뇌혈관질환 등 성인병 가운데 정해진 대상요인으로 인한 입원, 수술에 대해서 급부금을 지급하는 특약을 말한다.",DB생명,2025-08-14 13:18:54
353,세금우대저축,"저축에서 발생하는 이자 및 배당소득에 대한 원천징수세율을 9%로 하는 저축 (주민세별도) - 한도 : 20세이상 1천만원 / 60세이상 노인, 장애인 등 3천만원 (전 금융기관)",KNIA,2025-08-14 12:21:26
749,센티멘탈데미지,"일부분이 손상을 입었을 뿐인데도 전량에 대해서 손해를 청구하거나 현재의 손상이 확인되지 않았는데도 손상이 발생됐을 지도 모른다는 상상만으로 청구하는 등, 실체에 기초하지 않고 감정적으로 제기하는 손해를 말한다. 이것은 보험자로부터 보상받을 수 없다.",KIDI_BIGIN,2025-08-13 17:23:13
752,셀비지 어소시에이션,런던에 본부를 둔 조직으로서 세계 각지에 해사검정인을 배치하여 해난을 맞은 선박의 손상조사. 수리비 사정등 선박보험금의 정산에 필요한 제사항의 조사를 주요업무로 하고 있다.,KIDI_BIGIN,2025-08-13 17:23:13
754,소급보험,"보험기간은 보험계약 체결 후에 개시되는 것이 보통이지만, 보험기간의 개시시점을 보험계약 체결시보다 이전의 시점으로 소급시키는 보험을 말한다.",KIDI_BIGIN,2025-08-13 17:23:13
756,소급약관,"구영문해상보험증권에는 (멸실하였거나 그렇지않거나를 불문)이라는 규정이 있다. 이것을 소급약관이라고 한다. 이것은 손해가 보험계약 체결 전에 발생하였던 경우에도 피보험자가 그 사실을 알고 있었고, 보험자가 그것을 모르고 있었던 것이 아닌 한, 보험자에게 보상책임이 있음을 규정한 약관이다. 신 에도 이 약관이 있다.",KIDI_BIGIN,2025-08-13 17:23:13
355,소급약관 [영 : ],"구영문해상보험증권에는 (멸실하였거나 그렇지않거나를 불문)이라는 규정이 있다. 이것을 소급약관이라고 한다. 이것은 손해가 보험계약 체결 전에 발생하였던 경우에도 피보험자가 그 사실을 알고 있었고, 보험자가 그것을 모르고 있었던 것이 아닌 한, 보험자에게 보상책임이 있음을 규정한 약관이다. 신 에도 이 약관이 있다.",KNIA,2025-08-14 12:21:26
758,소득보상보험,"상해 또는 질병으로 인하여 의사의 치료가 필요하고, 전혀 취업을 할 수가 없게 되었을 경우(취업불능)에 피보험자가 입는 손실에 대하여 보험금을 지급하는 보험이다. 취업불능이 되고 나서 면책기간(7일, 14일, 30일 등)이 경과한 날로부터 보상기간(1년, 2년 등)내의 취업불능기간에 대해서 보험금이 지급된다. 그리고 상해로 인한 사망 ̇후유장해 담보특약을 부가함으로써, 사망보험금, 후유장애보험금이 지급된다.",KIDI_BIGIN,2025-08-13 17:23:13
273,소득보상보험 / /,"상해 또는 질병으로 인하여 의사의 치료가 필요하고, 전혀 취업을 할 수가 없게 되었을 경우(취업불능)에 피보험자가 입는 손실에 대하여 보험금을 지급하는 보험을 말한다. 취업불능이 되고 나서 면책기간(7일, 14일, 30일 등)이 경과한 날로부터 보상기간(1년, 2년 등)내의 취업불능기간에 대해서 보험금이 지급된다. 그리고 상해로 인한 사망·후유장해 담보특약을 부가함으로써, 사망보험금, 후유장애 보험금이 지급된다.",DB생명,2025-08-14 13:18:54
274,소멸 (구 보험계약의 소멸) / 의 /,"계약 당사자간 계약관계의 종료로 보험계약자와 보험회사간에 체결되었던 보험계약에 따른 제 권리 및 의무관계의 종료를 의미한다. 보험계약에 있어서 소멸사유에는 보험사고발생, 해약, 효력상실, 만료, 무효 등이 있다.",DB생명,2025-08-14 13:18:54
356,소멸 [영 : ],"보험계약이 보험기간의 만료, 보험기간 중의 피보험자 사망 또는 폐질, 해약 등으로 그 효력이 영구히 없어지는 것",KNIA,2025-08-14 12:21:26
