id,term,description,source,collected_date
415,장해등급,"장해란 부상 또는 질병이 치유되었을 때에 신체에 잔존하는 영구적인 정신 또는 육체의 훼손상태로 말미암아 발생하는 노동력의 상실이나 감소를 말하는 것으로, 신체의 해부학적 관점에서 우선 장해를 부위별로 나누고, 이를 기능에 중점을 둔 생리학적 관점에서 다시 여러종류의 장해군으로 구분한 것을 장해등급이라 한다.",KIDI_BIGIN,2025-08-13 17:22:59
384,장해등급 / /,"장해란 부상 또는 질병이 치유되었을 때에 신체에 잔존하는 영구적인 정신 또는 육체의 훼손상태로 말미암아 발생하는 노동력의 상실이나 감소를 말하는 것으로, 신체의 해부학적 관점에서 우선 장해를 부위별로 나누고, 이를 기능의 면에 중점을 둔 생리학적 관점에서 다시 수종의 장해군으로 구분한 것을 장해등급이라 한다. 생명보험에서는 노동능력의 상실정도에 따라 신체장해를 1급부터 6급으로 구분하여 사용한다. 보험회사에서는 일정한 기간내에 일정한 신체장해의 상태가 되었을 때에는 판정된 장해등급에 기준한 보험금액을 지급하게 된다. 장해부위는 신체를 해부학적 관점에서는 눈, 코, 귀, 입, 신경계통의 기능 또는 정신, 흉복부, 장기, 팔, 다리 등으로 구분하고 생리학적 관점에서 신체의 장해정도에 따라 등급을 부여하고 있다.",DB생명,2025-08-14 13:18:54
416,재고가액 통지특약,"화재보험에서 보험의 목적인 상품이나 재고품과 같이 부단히 수량이 변동하는 것에 대한 특약이다. 사고발생시의 일부보험이나 초과보험을 없애기 위하여 계약시에 고정된 보험금액을 정해놓지 않고, 보험계약자에게 정기적으로 재고량을 통지하도록 하며, 보험자는 계약시에 정한 보상한도액을 한도로해서 실손해를 보상하기로 한 특약이다. 따라서 보험료는 보상한도액의 75%해당액을 계약체결시에 예치하고 보험기간이 끝난 후 통지된 재고가액의 평균가액을 산출하여 확정보험료를 계산하게 된다.",KIDI_BIGIN,2025-08-13 17:22:59
566,재고자산,"원부재료, 재공품, 반제품, 제품, 부산물과 상품 및 기타 이와 유사한 것",KNIA,2025-08-14 12:21:26
417,재단표,"생명보험회사의 경험에서 만들어지는 경험생명표의 한 분류이다. 경험표에서 일반 사망률을 도출하는 경우, 계약시의 위험선택의 결과에 따라 최초의 수년간은 보통에 비해서 특히 사망률이 저율로 나타난다. 그래서 계약 후의 일정연수를 제외하고 작성된 것이 재단표이다. 이렇게 작성된 표를 제외연수에 따라 3년 재단표 또는 5년 재단표 등으로 말한다.",KIDI_BIGIN,2025-08-13 17:22:59
418,재무대출,"보험회사가 하는 대출 가운데, 보험약관에 의거하여 계약자에게하는 계약자 대출을 제외한 대출를 말하며, 보험회사의 대출의 대부분을 차지하고 있다. 재무대출은 담보의 유무, 담보의 구분 등에 따라 신용대출, 부동산 저당대출, 유가증권 부담보대출 등으로 나뉜다. 재무대출은 투융자 환경의 변화와 그에수반된 규제의 완화 등으로 말미암아 점차 다양화되고 있다.",KIDI_BIGIN,2025-08-13 17:22:59
202,재무설계,생활자금목표를 달성하기 위해서 오랜 준비기간과 많은 자금의 수요가 예상되므로 그 시기를 감안하여 장래 가정에 필요한 자금의 준비를 계획적으로 해두는 것을 말한다.,한화생명,2025-08-14 14:29:51
385,재무제표 / /,"재무제표란 기업의 거래내용을 측정, 기록, 분류, 요약하여 작성되는 회계보고서이다. 재무제표는 한 기업이 일정시점에서의 경제적 상황과 일정기간 동안의 경제적 활동내용을 표시할 뿐만 아니라, 기업의 여러 이해관계자들에게 보고되어 정보이용자의 의사결정을 위한 정보의 원천이 되고, 제세금의 과세를 위한 기초자료가 되며, 또한 이익배당액을 결정하는 기본자료가 된다. 재무제표는 대차대조표, 손익계산서, 이익잉여금 처분계산서 및 결손금 처리계산서, 현금흐름표 등 4가지로 구성된다.",DB생명,2025-08-14 13:18:54
567,재물보험,화재등으로 인해 보험의 목적인 재물에 생긴 손해를 보장하는 보험,KNIA,2025-08-14 12:21:26
568,재물손해,물리적으로 망가뜨려진 유체물의 직접손해와 물리적으로 망가뜨려진 유체물의 사용불능으로 생긴 간접손해,KNIA,2025-08-14 12:21:26
419,재보험,"원수보험회사가 인수한 보험계약의 책임의 일부 또는 전부를 다른 보험회사(재보험회사)에 전가하는 방식을 말한다. 원수회사가 재보험에 내놓은 행위를 출재보험, 재보험회사가 재보험을 받아들이는 행위를 수재보험이라고 한다. 재보험이란 말하자면 보험의 보험인 것인데, 그 역할은 다른 보험회사로 위험을 분산하여 고액보험의 인수능력을 확대 자산운용의 계획화 원수회사가 고도의 위험 ̇평가 곤란한 위험을 사정할 때, 경험이 풍부한 재보험회사로부터 협력을 얻을 수 있다는 것 등이다. 재보험의 분류는 절차에 의한 것과 금액의 결정방법에 의한 것으로 대별된다. 에는 특약재보험(재보험특약으로 정해놓은 범위내에서 원수계약의 성립과 동시에, 그것의 일부 또는 전부에 대해서 재보험계약이 성립된 것으로 하는 방식) 임의재보험(재보험회사가 인수할 경우에만 출재하는 방식)이 있다. 에는 비례식 재보험(개개의 계약에 대해서 보험사고 발생때마다 출재비율에 따라 재보험금을 지급하도록 약정된 것) 비비례식 재보험(출재대상계약 전체에 대해서 일정기간내의 발생손해 총액이 미리 설정한 금액을 초과하였을 경우에 초과분을 재보험금으로서 지급하도록 약정된 것)과 일정손해액을 초과한 초과손해보험금을 재보험금으로서 지급하도록 약정한 것이 있다. 비례식재보험은 다시 ᄀ비례재보험(원수계약의 일정비율을 출재하는 방식) ᄂ초과액 재보험(미리 설정한 보유한도액-원수회사가 한 위험에 대해서 감당할 수 있는 한도액-을 초과하는 부분을 출재하는 방식)의 두 가지로 분류된다. 또한 생명보험의 재보험에서는 위험보험료식(원수계약의 위험보험금의 일부 또는 전부를 정기보험으로 해서 체결하는 방식) 공동보험식(원수계약과 재보험계약이 같은 종류 ̇조건인 방식) 수정공동보험식(공동보험식에서 재보험회사가 적립하는 책임준비금을 원수회사에게 예금하는 형식으로 한 방식)이라는 구분도 채택되고 있다.",KIDI_BIGIN,2025-08-13 17:22:59
215,재보험,보험회사가 인수한 보험계약을 위해 다른 보험회사에 부보하는 것을 말하는 것으로 위험을 분산과 보험계약 인수능력의 증대 효과를 가져온다.,한화생명,2025-08-14 14:29:51
386,재보험 / /,"한 보험회사가 자기가 인수한 계약중의 일부 또는 전부에 대하여 다른 보험회사에 다시 보험가입을 함으로써 위험을 전가하는 것을 말한다. 이 경우 재보험을 출재하는 보험회사를 출재회사, 재보험을 인수하는 회사를 재보험회사라고 한다. 즉 재보험이란 출재회사가 재보험료를 재보험회사에 납입하는 대가로 재보험회사로부터 재보험금을 회수하는 쌍무계약이다. 따라서 출재회사의 입장에서 볼 때 재보험은 위험의 분산 및 이익의 평준화를 기해 주는 동시에 보험계약 인수능력을 증대시켜주는 기능을 지니고 있다.",DB생명,2025-08-14 13:18:54
569,재보험 [영 : ],"보험회사가 인수한 계약의 일부를 다른 보험회사에 인수시키는 것. 재보험 계약을 통하여 다른 보험자에게 인수시키는 것을 출재라고 하며, 반대로 다른 회사의 보상책임을 인수하는 재보험 거래를 수재라고 함",KNIA,2025-08-14 12:21:26
430,재보험 수수료,"재보험회사가 원수회사(출재회사)에게 재보험인수에 대해서 재보험료의 일정률을 지급하는 수수료. 다만 생명보험에서 많이 하고 있는 위험보험료식 재보험은 갱신조건부 1년 정기보험으로 실시되고 있으며, 재보험료는 사망 위험에 대한 순보험료에 재보험회사의 사무비로 약간의 부가보험료가 가해질 뿐이므로, 보통원수회사(출재회사)에 대한 재보험 수수료는 지급되지 않는다.",KIDI_BIGIN,2025-08-13 17:23:00
218,재보험 수수료,"재보험회사가 원수회사(출재회사)에게 재보험인수에 대해서 재보험의 일정률을 지급하는 수수료. 다만 생명보험에서 많이 하고 있는 위험보험료식 재보험은 갱신조건부 1년 정기보험으로 실시되고 있으며, 재보험료는 사망 위험에 대한 순보험료에 재보험회사의 사무비로 약간의 부가보험료가 가해질 뿐이므로, 보통원수회사(출재회사)에 대한 재보험 수수료는 지급되지 않는다.",한화생명,2025-08-14 14:29:51
387,재보험 수수료 / /,"재보험회사가 원수회사(재보험 가입회사)에게 재보험 인수에 대해서 재보험료의 일정률을 지급하는 수수료이다. 그러나, 생명보험에서 많이 하고 있는 위험보험료식 재보험은 갱신조건부 1년 정기보험으로 실시되고 있으며, 재보험료는 사망위험에 대한 순보험료에 재보험회사의 사업비로 약간의 부가보험료가 더해질 뿐이므로, 보통 원수회사에 대한 재보험 수수료는 지급되지 않는다.",DB생명,2025-08-14 13:18:54
435,재보험 중개인,"원수보험회사와 재보험회사의 사이에서 재보험계약 체결을 매개하는 보험중개인을 말한다. 재보험거래의 중개에는 리스크의 내용, 요율 등의 인수조건과 재보험시장의 소화능력 등에 대해서 충분히 정통한 지식과 경험이 필요하다.",KIDI_BIGIN,2025-08-13 17:23:00
216,재보험 중개인,"원수보험회사와 재보험회사의 사이에서 재보험계약 체결을 매개하는 보험중개인을 말한다. 재보험거래의 중개에는 리스크의 내용, 요율 등의 인수조건과 재보험시장의 소화능력 등에 대해서 충분히 정통한 지식과 경험이 필요하다.",한화생명,2025-08-14 14:29:51
223,재보험 특약,"재보험거래에서 미리 당사자간의 합의해 놓은 대상계약, 계보험조건 등 일체의 내용을 조문화한 약정. 이것은 결정된 일정기간의 재보험이 원활하게 이행되게 하기 위해서 원수회사(출재회사)와 재보험회사간에 교환되는 것이며, 여기에 따라 당사자의 재보험신청, 인수가 시행된다. 이것에 의해서 다수의 계약이 계속적, 자동적으로 재보험처리된다.",한화생명,2025-08-14 14:29:51
221,재보험 풀,"다수의 보험회사가 각자 인수한 보험계약의 전부 또는 일부를 풀(공동계산)해서 그것을 각개의 가입회사의 인수능력, 실적 등을 감안하여 미리 정해진 배분비율에 따라 가입회사에게 재분배하는식",한화생명,2025-08-14 14:29:51
424,재보험계약,"보험회사가 보험계약에 의해서 인수한 책임의 전부 또는 일부를 다른 보험회사에 부보하는 계약을 말한다. 재보험금 \\ , 보험회사가 인수한 원수 또는 수재보험계약이 재보험되어 있는 경우 보험금을 지급하였을 때에는 출재된 재보험금액에 따른 액수가 재보험회사로부터 회수되는데, 이것을 재보험금이라고 한다.",KIDI_BIGIN,2025-08-13 17:23:00
220,재보험계약,"다수의 보험회사가 각자 인수한 보험계약의 전부 또는 일부를 풀(공동계산)해서 그것을 각개의 입회사의 인수능력, 실적 등을 감안하여 미리 정해진 배분비율에 따라 가입회사에게 재분배하는 방식",한화생명,2025-08-14 14:29:51
388,재보험계약 / /,보험회사가 보험계약에 의해서 인수한 책임의 전부 또는 일부를 다른 보험회사에 전가하는 계약을 말한다.,DB생명,2025-08-14 13:18:54
217,재보험금,"보험회사가 인수한 원수 또는 수재보험계약이 재보험되어 있는 경우 보험금을 지급하였을 때에는 출재된 재보험 금액에 따른 액수가 재보험회사로부터 회수되는데, 이것을 재보험금이라고 한다.",한화생명,2025-08-14 14:29:51
389,재보험금 / / ;,보험회사가 인수한 계약을 재보험회사에 재보험으로 가입한후 보험금 지급사유 발생으로 재보험사로부터 보험금을 지급받는 금액을 재보험금이라고 한다.,DB생명,2025-08-14 13:18:54
427,재보험단위,"보험자가 초과액재보험특약에 의거하여 재보험을 행하는 경우 상대방의 부담력 또는 상대방이 제공하는 교환재보험의 양을 협의하고 출재금액의 한도를 정한다. 이것은 금액을 가지고 표시하는 경우도 있으나, 보험자의 보유액을 단위로 하여 그 재보험단위(배수)를 가지고 출재액의 단위를 표시하는 경우가 있다. 재보험단위(출재배수)란 이 출재액의 한도를 표시하는 단위 즉 배수를 말한다.",KIDI_BIGIN,2025-08-13 17:23:00
428,재보험료,"재보험회사가 재보험금 지급책임을 원수회사 (출재회사)로부터 수재보험하는 보험계약상의 책임을 부담하는 대가로 받는 보험료를 말한다. 원수회사(출재회사)측에서 볼 때에는 자기가 체결한 보험계약의 일부를 재보험회사에 출재하는데, 상대방에게 부담시키는 책임을 재보험회사에게 지급하는 보험료가 된다.",KIDI_BIGIN,2025-08-13 17:23:00
222,재보험료,"재보험회사가 재보험금 지급책임을 원수회사(출재회사)로부터 수재보험하는 보험계약상의 책임을 부담하는 대가로 받는 보험료를 말한다. 원수회사(출재회사)측에서 볼 때에는 자기가 체결한 보험계약의 일부 또는 전부를 재보험회사에 출재하는데, 상대방에게 부담시키는 책임을 재보험회사에게 지급하는 보험료가 된다.",한화생명,2025-08-14 14:29:51
390,재보험료 / /,보험회사가 인수한 계약을 재보험사에 가입할 때 지급하는 보험료를 말한다.,DB생명,2025-08-14 13:18:54
432,재보험자,원보험자로 부터 출재되는 재보험을 인수하는 보험자의 총칭이다. 그러나 협의로 사용되는 경우에는 제1차 재보험의 보험자에 대한 호칭에 국한되고 제1차 재보험자로부터의 출재를 인수하는 제2차 수재보험자를 재재보험자라부른다.,KIDI_BIGIN,2025-08-13 17:23:00
437,재보험특약,"재보험거래에서 미리 당사자간에 합의해 놓은 대상계약 ̇재보험조건 등 일체의 내용을 조문화한 약정. 이것은 결정된 일정기간의 재보험이 원활하게 이행되게 하기 위해서 원수회사(출재회사)와 재보험회 사간에 교환되는 것이며, 여기에 따라 양당사자의 재보험신청 ̇인수가 시행된다. 이것에 의해서 다수의 계약이 계속적 ̇자동적으로 재보험 처리된다.",KIDI_BIGIN,2025-08-13 17:23:01
391,재보험특약 / /,"재보험거래에서 미리 당사자간에 합의해 놓은 대상계약·재보험조건 등 일체의 내용을 조문화한 약정이다. 이것은 결정된 일정기간의 재보험이 원활하게 이행되게 하기 위해서 원수회사와 재보험회사간에 교환되는 것으로, 여기에 따라 양 당사자의 재보험신청·인수가 시행된다. 이것에 의해서 다수의 계약이 계속적·자동적으로 재보험 처리되기도 한다.",DB생명,2025-08-14 13:18:54
439,재보험풀,"다수의 보험회사가 각자 인수한 보험계약의 전부 또는 일부를 풀(공동계산)해서 그것을 각개의 가입회사의 인수능력, 실적 등을 감안하여 미리 정해진 배분비율에 따라 가입회사에게 재배분하는 방식. 재보험회사 , 원수보험사업은 하지 않고, 전적으로 보험회사를 상대로 하는 재보험사업만을 영위하는 회사.",KIDI_BIGIN,2025-08-13 17:23:01
392,재보험풀 / /,"다수의 보험회사가 각자 인수한 보험계약의 전부 또는 일부를 풀(공동계산)해서 그것을 각개의 가입회사의 인수능력, 실적 등을 감안하여 미리 정해진 배분 비율에 따라 가입회사에게 재배분하는 방식이다.",DB생명,2025-08-14 13:18:54
219,재보험회사,"원수보험사업은 하지 않고, 전적으로 보험회사를 상대로 하는 재보험사업만을 영위하는회사",한화생명,2025-08-14 14:29:51
393,재보험회사 (구 재보험자) / /,"원보험회사가 가입하는 재보험을 인수하는 보험자(보험회사)의 총칭이며, 협의로 사용되는 경우에는 제1차 재보험의 보험자에 대한 호칭에 국한되고 제1차 재보험자로부터의 출재를 인수하는 제2차 수재보험자를 재재보험자라 부른다.",DB생명,2025-08-14 13:18:54
442,재산보험,"보험은 사고발생의 객체에 따라서 인보험과 재산보험의 두 가지로 나눌 수 있다. 사람에 관해서 생기는 사고는 생명보험 또는 상해보험 등의 대상인 것이며, 재산에 관해서 생기는 사고는 화재보험, 자동차보험, 해상보험 또는 비용 ̇이익보험 등의 대상이다.",KIDI_BIGIN,2025-08-13 17:23:01
394,재산보험 / /,"보험은 사고발생의 객체에 따라서 인보험과 재산보험의 두가지로 나눌 수 있는데, 사람에 관해서 생기는 사고는 생명보험 또는 상해보험 등을 대상으로 하며, 재산에 관해서 생기는 사고는 화재보험, 자동차보험, 해상보험 또는 비용·이익보험 등을 대상으로 한다.",DB생명,2025-08-14 13:18:54
444,재재보험,"재보험금으로서 받은 계약 즉, 수재보험 일부 또는 전부를 다시 다른 보험자에게 재보험하는 것을 말한다. 위험의 거대화, 범세계로의 위험분산의 필요성 및 재보험자의 보유능력제한 등으로 말미암아 오늘날의 재보험자는 그가 인수한 재보험계약을 재재보험으로 출재하는 일이 많다. 재재보험계약을 인수하는 보험자를 재재보험자라고 한다.",KIDI_BIGIN,2025-08-13 17:23:01
395,재재보험 / /,"재보험회사가 재보험계약의 전부 또는 일부를 다시 다른 보험자에게 위험의 전가를 위해 계약을 체결하는 보험을 말하는 것으로, 위험의 거대화, 범세계로의 위험분산의 필요성 및 재보험자의 보유능력제한 등으로 말미암아 오늘날의 재보험자는 그가 인수한 재보험계약을 재재보험으로 출재하는 일이 많다.",DB생명,2025-08-14 13:18:54
570,재정검증,확정급여형 퇴직연금제도의 적립금이 법에서 정한 수준 이상으로 적립되고 있는지 매 사업연도말 검증하는 것을 말함.,KNIA,2025-08-14 12:21:26
571,재정적위험,"계약자의 소득 대비 과다한 보험료 납입으로 인하여 계약이 조기실효될 위험, 혹은 피보험자의 소득 대비 과다한 보장으로 인하여 고의사고가 발생할 위험",KNIA,2025-08-14 12:21:26
445,재조달가액,"보험계약의 대상물(보험의 목적)과 동등한 것을 재취득 또는 재구입하기 위하여 소요되는 액수. 손해보험에서는 시가를 기준으로 산출하는 보험이 많은데(시가주의) 재조달가액을 기준으로 하는 손해보상 방식을 채택함으로써 보다 완전한 복구를 이룩할 수가 있다. 화재보험의 가액협정특약, 신가보험 등에 이 방식이 도입되어 있다.",KIDI_BIGIN,2025-08-13 17:23:01
572,재조달가액 [영 : ],"보험계약의 대상물(보험의 목적)과 동등한 것을 재취득 또는 재구입하기 위하여 소요되는 액수. 손해보험에서는 시가를 기준으로 산출하는 보험이 많은데(시가주의) 재조달가액을 기준으로 하는 손해보상 방식을 채택함으로써 보다 완전한 복구를 이룩할 수가 있다. 화재보험의 가액협정특약, 신가보험 등에 이 방식이 도입되어 있다.",KNIA,2025-08-14 12:21:26
910,재해 고도장해 보험금(,명보험의 재해관련 특약의 하나인 재해사망 특약에 의해서 지급되는 보험금으로써 피보험자가 고도의 장해를 입었을 때 계약가입 보험금액의 100%가 지급된다,KIDI_BIGIN,2025-08-13 17:23:19
396,재해고도장해보험금 / /,생명보험의 재해관련 특약의 하나인 재해사망 특약에 의해서 피보험자가 고도의 장해를 입었을 때 지급되는 보험금을 말한다.,DB생명,2025-08-14 13:18:54
397,재해관련 특약 / /,"생명보험 주계약에 부가하여 피보험자가 지급사유에 해당되었을 때, 급부금 지급에 관한 특약으로서 재해사망특약, 재해상해특약, 가족재해특약, 재해임원특약, 교통재해보장특약 및 가족교통재해보장특약 등이 있다.",DB생명,2025-08-14 13:18:54
449,재해관련특약,"생명보험보통약관(주계약)에 부가하여 피보험자가 지급사유에 해당되었을 때, 급부금 지급에 관한 특약으로서 재해사망특약, 재해상해특약, 가족재해특약, 재해임원특약, 교통재해보장특약 및 가족교통재해보장특약이 있다.",KIDI_BIGIN,2025-08-13 17:23:01
398,재해사망 / /,외부로부터 예측할 수 없는 우연한 사고가 직접적인 원인이 되어서 사망하는 것을 말한다. 재해사고로 인하여 사망한금을 재해사망보험금이라고 하며 이 경우에는 계약보험가입금액의 100%가 지급된다.,DB생명,2025-08-14 13:18:54
450,재해사망보험금,"재해사망특약, 가족재해 특약 및 교통재해보장특약 등에 의해서 지급되는 보험금. 특약기간 중 예측할 수 없는 사고가 직접적인 원인이 되어서 사망하였을 때 계약보험가입금액의 100%가 지급된다.",KIDI_BIGIN,2025-08-13 17:23:01
399,재해사망보험금 / /,"재해사망특약, 가족재해특약 및 교통재해보장특약 등에 의해서 지급되는 보험금이다. 특약기간 중 예측할 수 없는 사고가 직접적인 원인이 되어서 사망하였을 때 계약보험가입금액의 100%가 지급된다.",DB생명,2025-08-14 13:18:54
453,재해사망특약,"생명보험의 재해관련 특약의 하나로서, 예측 못한 사고가 직접적인 원인이 되어 사망하거나 고도의 장해를 입었을 때 계약보험가입금액의 100%가 지급된다.",KIDI_BIGIN,2025-08-13 17:23:01
206,재해사망특약,"생명보험의 재해관련 특약의 하나로서, 예측못한 사고가 직접적인 원인이 되어 사망하거나 고도의 장해를 입었을 때 계약보험가입금액의 100%가 지급된다.",한화생명,2025-08-14 14:29:51
400,재해사망특약 / /,"생명보험의 재해관련 특약의 하나로서, 예측 못한 사고가 직접적인 원인이 되어 사망하거나 고도의 장해를 입었을 때 계약보험가입 금액의 일정률이 지급된다.",DB생명,2025-08-14 13:18:54
455,재해상해특약,"생명보험계약에 부가하는 재해관련특약의 일종. 피보험자가 재해로 인한 상해를 입었을 때, 장해급수에 따라 장해급여금이 지급된다. 예컨데 1급 장해는 계약보험금액의 70%, 3급 장해는 50%가 지급된다.",KIDI_BIGIN,2025-08-13 17:23:02
401,재해상해특약 / /,"생명보험계약에 부가되는 재해관련특약의 일종으로, 피보험자가 재해로 인한 상해를 입었을 때 장해급수에 따라 장해급여금이 지급된다.",DB생명,2025-08-14 13:18:54
456,저당권자특약,"채권보전을 위하여 저당권자가 저당물(보험의 목적)의 소유자를 피보험자로 하는 화재보험 및 선박보험계약에 의거한 보험금 청구권을 넘겨받을 경우에 그 대항요건으로서 채무자인 보험자의 승인을 얻을 때, 보험자와 저당권자 사이에 교환되는 약정을 말한다. 약정안에 피보험자의 통지의무 위반이 있더라도 저당권자에게 보험금을 지급한다는 사항과, 보험자가 계약을 해약할 경우에는 저당권자에게 예고하겠다는 사항 등의 조항을 넣고 있다.",KIDI_BIGIN,2025-08-13 17:23:02
210,저당권자특약,"채권보전을 위하여 저당권자가 저당물(보험의 목적)의 소유를 피보험자(보험대상자)로 하는 화재보험 및 선박보험계약에 의거한 보험금 청구권을 넘겨받을 경우에 그 대항요건으로서 채무자인 보험자의 승인을 얻을 때, 보험자와 저당권자 사이에 교환되는 약정을 말한다. 약정안에 피보험자(보험대상자)의 통지의무위반이 있더라도 저당권자에게 보험금을 지급한다는 사항과, 보험자가 계약을 해약할 경우에는 저당권자에게 예고하겠다는 사항 등의 조항을 넣고 있다.",한화생명,2025-08-14 14:29:51
