id,term,description,source,collected_date
359,무진단보험,"무진단생명보험이라거도 한다. 보험을 계약할 때에 의학적 진단을 실시하지 않고 청약서의 고지와 모집인의 망진 및 문진에 의하여 계약을 인수하는 보험을 말한다. 무진단보험은 의학적 선택을 생략하는 것인 만큼, 신체상황에 관한 상세한 고지가 필요하다. 무진단보험의 사망률은 유진단보험에 비해서 높아지는 것이 보통이므로 무진단보험에서는 보험금액, 가입 연령에 제한을 두고 있다.",KIDI_BIGIN,2025-08-13 17:22:57
78,무진단보험,의사의 진단을 거치지 않고 가입자의 서면에 의한 고지 등을 가지고 선택하는 보험을 무진단보험이라고 한다. 보험금액의 일정한도까지는 보통 무진단보험이다.,한화생명,2025-08-14 14:29:51
119,무진단보험 / /,보험계약 청약시 그 위험의 정도를 측정하기 위해서 보험대상자(피보험자)에 대한 건강진단을 실시하는 것이 원칙이다. 그러나 모든 계약에 대하여 건강진단을 실시하는 것은 오히려 업무의 과중과 많은 경비의 손실을 초래할 뿐 그 실익이 없는 경우가 많다. 따라서 건강진단의 실익이 없는 계약에 대해서는 건강진단을 거치지 않는데 이것을 무진단보험이라 한다.,DB생명,2025-08-14 13:18:54
170,무한궤도식 건설기계,"바퀴의 형태가 강판제의 판을 체인 모양으로 연결 하고, 이것을 앞·뒤바퀴에 벨트처럼 걸어 동력으로 회전시켜서 주행하게 하는 장치로 탱크 바퀴와 동일함",KNIA,2025-08-14 12:21:26
171,묵시적 승인,직접적인 말 또는 행동이 아니라 간접적으로 해당 행위에 대해 승인하는 것,KNIA,2025-08-14 12:21:26
120,문진 / /,"생명보험계약시에 보험대상자(피보험자)의 과거 및 현재의 건강상태, 가족의 건강 여부, 유전관계 등을 질문하여 사실을 인지하는 것을 말한다. 기타 성명, 생년월일, 직업 등 일정한 조항대로 하는 것인데, 유진단인 경우에는 의사가 문진하게 되고, 무진단 청약인 경우에는 모집자가 질문표의 내용에 대하여 고지를 요구함을 말한다.",DB생명,2025-08-14 13:18:54
79,물가슬라이드형연금,물가상승률에 연동하여 연금액을 매년 상향조정하는 경우,한화생명,2025-08-14 14:29:51
172,물적사고 할증기준금액,대물 및 자차사고시 갱신보험료 할증 또는 할인유예를 결정하는 기준이 되는 금액. 물적사고 할증기준금액을 낮게 설정하면 보험료는 저렴해짐,KNIA,2025-08-14 12:21:26
173,물체,"구체적인 형체를 지니고 있어 충돌이나 접촉에 의해 자동차 외부에 직접적인 손상을 줄 수 있는 것을 말하며, 엔진내부나 연료탱크 등에 이물질을 삽입하는 경우 물체로 보지 않습니다.",KNIA,2025-08-14 12:21:26
360,미경과보험,수입보험료 가운데 아직 보험자의 책임이 잔존하고 있는 기간(이것을 미경과기간이라고 한다.)에 상응하는 부분을 말한다. 이를테면 연납보험료의 경우에는 납입일로부터 6개월이 경과된 시점에서는 보험료의 50%가 미경과보험료인 것이다. 보험회사의 사업연도 결산에서는 책임준비금에 미경과보험료 준비금이 포함되어 있다. → 경과보험료,KIDI_BIGIN,2025-08-13 17:22:57
174,미경과보험,수입보험료 가운데 아직 보험자의 책임이 잔존하고 있는 기간(이것을 미경과기간이라고 한다.)에 상응하는 부분을 말한다. 이를테면 연납보험료의 경우에는 납입일로부터 6개월이 경과된 시점에서는 보험료의 50%가 미경과보험료인 것이다. 보험회사의 사업연도 결산에서는 책임준비금에 미경과보험료 준비금이 포함되어 있다.,KNIA,2025-08-14 12:21:26
121,미경과보험료 / /,수입보험료중 아직 보험자의 책임이 남아 있는 기간에 대한 부분을 미경과 보험료라 한다. 미경과보험료는 책임준비금에 포함되고 보험료 및 책임준비금 산출방법에 의하여 산출된다.,DB생명,2025-08-14 13:18:54
92,미경과보험료 준비금,"개개인 보험계약의 보험기간은 통상 2개 사업연도 이상에 걸치게 되는 경우가 흔하다. 따라서 보험자는 연 1회의 결산시에 그 연도 중의 수입보험료의 전부를 이익으로 간주할 수는 없는 것이며, 보험료 가운데 차기로 이월하는 미경과분을 준비금으로 적립해둘 필요가 있는데, 이 준비금을 미경과보험료 준비금이라고 한다.",한화생명,2025-08-14 14:29:51
122,미경과보험료 준비금 / /,"개개의 보험계약의 보험기간은 통상 2개사업 연도 이상에 걸치게 되는 경우가 흔하다. 따라서 보험자는 연1회의 결산시에 그 연도중의 수입보험료의 전부를 이익으로 간주할 수는 없는 것이며, 보험료 가운데 차기로 이월하는 미경과분을 준비금으로 적립해 둘 필요가 있는 데, 이 준비금을 미경과보험료 준비금이라고 한다.",DB생명,2025-08-14 13:18:54
361,미경과보험료 준비금(,"개개의 보험계약의 보험기간은 통상 2개사업연도 이상에 걸치게 되는 경우가 흔하다. 따라서 보험자는 연 1회의 결산시에 그 연도 중의 수입보험료의 전부를 이익으로 간주할 수는 없는 것이며, 보험료 가운데 차기로 이월하는 미경과분을 준비금으로 적립해둘 필요가 있는데, 이 준비금을 미경과보험료 준비금 이라고 한다.",KIDI_BIGIN,2025-08-13 17:22:57
82,미경과보험료적립금,납입기일이 당해 사업연도에 속하는 수입보험료 중에서 사업연도 말 현재 기간이 경과하지 않은 보험료로서 보험료 및 책임준비금 산출방법서에 의하여 계산된 금액으로 한다.,한화생명,2025-08-14 14:29:51
362,미국생명보험업자단체(,미국생명보험업자단체.,KIDI_BIGIN,2025-08-13 17:22:57
363,미국협회 선박보험 약관,"미국 해상보험업자협회가 제정한 표준약관의 하나로, 선박보험의 기간계약에 사용된다.",KIDI_BIGIN,2025-08-13 17:22:57
123,미보고발생손해액 / /,보험사고가 이미 발생하였으나 아직 보험회사에 청구되지 아니한 사고에 대해 향후 지급될 보험금 추정액을 말하며 보험금의 지급재원인 책임준비금에 포함된다.,DB생명,2025-08-14 13:18:54
83,미적립채무,기발생채무 중 자산으로 미적립된 부분,한화생명,2025-08-14 14:29:51
364,미지급보험금,"보험사고 및 손해는 발생하였으나 보상여부 및 보험금 사정의 미결 또는 소송이 계류 중인 크레임 등의 이유로 결산시나 경영분석 또는 산출시점 현재 지급되지 않은 보험금을 말한다. 이 미지급보험금의 적정한 추정은 생명보험에서도 중요하나, 손해보험에서는 보험사고 발생일과 보험금 지급일이 장기간 요하는 배상책임보험에서는 특히 중요한 것이다.",KIDI_BIGIN,2025-08-13 17:22:57
91,미지급보험료,"보험사고 및 손해는 발생하였으나 보상여부 및 보험금 사정의 미결 또는 소송이 계류 중인 크레임 등의 이유로 결산 시나 경영분석 또는 산출시점 현재 지급되지 않은 보험금을 말한다. 이 미지급보험금의 적정한 추정은 생명보험에서도 중요하나, 손해보험에서는 보험사고 발생일과 보험금 지급일이 장기간 요하는 배상책임보험에서는 특히 중요한 것이다.",한화생명,2025-08-14 14:29:51
176,미지급이자,"환급금 지급사유(해지,만기,중도,실효 등)가 발생한 날로부터 환급금 청구일까지의 기간에 대한 부리이자 (최대 2년)",KNIA,2025-08-14 12:21:26
177,미평가보험 [영 : ],"보험계약의 당사자에 의하여 보험가액이 미리 약정되어 있지 않는 보험. 이러한 보험계약에 대하여는 보험사고가 발생한 경우 또는 초과보험이나 중복보험인가 아닌가를 결정할 때 일정한 기준에 따라 보험가액을 결정해야 하기 때문에, 해상보험을 제외한 각종 보통 보험약관에 규정이 있고 상법도 보험사고 발생시의 가액을 보험가액으로 한다고 규정하고 있음.",KNIA,2025-08-14 12:21:26
365,미평가보험:,"= 평가미제보험 보험계약의 당사자에 의하여 보험가액이 미리 약정되어 있지 않는 보험을 가리킨다. 이러한 보험계약에 대하여는 보험사고가 발생한 경우 또는 초과보험이나 중복보험인가 아닌가를 결정할 때 일정한 기준에 따라 보험가액을 결정해야 하기 때문에, 해상보험을 제외한 각종 보통 보험약관에 규정이 있고 상법도 보험사고 발생시의 가액을 보험가액으로 한다고 규정하고 있다.",KIDI_BIGIN,2025-08-13 17:22:57
178,미필적 고의,일정한 결과 발생 가능성을 인식하면서도 감히 행하는 행위,KNIA,2025-08-14 12:21:26
366,미확정보험(예정보험)계약,"보험계약의 내용 특히 보험의 목적, 보험금액, 적재선박 등이 확정되지 않은 채 그 범위를 개괄적으로 정하고, 그 내용이 확정되고 또 위험이 개시될 때에 보험자가 당연히 위험을 담보하고 보험료를 청구하기로 하는 보험계약을 말한다. 이는 어디까지나 보험계약이며, 보험계약의 예정은 아니다.",KIDI_BIGIN,2025-08-13 17:22:57
180,민사상책임,"차의 운행으로 타인의 신체나 재물을 손괴한 경우 그 손해의 보상을 위해, 자동차손해배상보장법 상의 운행자 책임 또는 민법상 불법행위책임 내지 사용자책임",KNIA,2025-08-14 12:21:26
367,민영보험,"보험은 경영 주체에 따라 민영보험과 공영보험으로 대별되는데, 민영보험은 경영 주체가 개인 또는 사법인인 것을 말하며, 사보험이라고도 한다. 사법인이 경영주체가 되는 것은 다시 회사형태와 조합형태로 나누어지는데, 회사형태에는 주식회사와 상호회사가 있다.",KIDI_BIGIN,2025-08-13 17:22:57
89,민영보험,"보험은 경영 주체에 따라 민영보험과 공영보험으로 대별되는데, 민영보험은 경영 주체가 개인 또는 사법인인 것을 말하며, 사보험이라고도 한다. 사법인이 경영주체가 되는 것은 다시 회사형태와 조합형태로 나누어지는데, 회사형태에는 주식회사와 상호회사가 있다.",한화생명,2025-08-14 14:29:51
124,민영보험 / /,"국가에서 실시하는 사회보험(공보험)과 대별되는 개념으로 사보험이라고도 한다. 대체로 사회보험과 민영보험의 관계는 상호보완적인 성격을 지니고 있으며 전자를 통해서 사회적으로 필요한 국민최저생활을 보장하고, 이 최저선 이상은 개인이 스스로의 노력으로 민영보험을 통해서 갖가지 위험의 발생으로부터 오는 경제타격의 정도를 완화시키도록 한다.",DB생명,2025-08-14 13:18:54
181,민영보험 [영 : ],"보험은 경영 주체에 따라 민영보험과 공영보험으로 대별되는데, 민영보험은 경영 주체가 개인 또는 사법인인 것을 말하며, 사보험이라고도 한다. 사법인이 경영주체가 되는 것은 다시 회사형태와 조합형태로 나누어지는데, 회사형태에는 주식회사와 상호회사가 있다.",KNIA,2025-08-14 12:21:26
182,방문적부,방문을 통하여 피보험자의 직업 및 고지사항을 확인하는 절차,KNIA,2025-08-14 12:21:26
183,방카슈랑스,"프랑스어로 은행을 뜻하는 방크와 보험이라는 의미의 아슈랑스가 합쳐진 말. 은행이 보험회사와 연계해 보험 성격이 짙은 상품을 개발, 판매하는 것으로 은행과 보험사가 상호 제휴와 업무협력을 통해 종합금융서비스를 제공하는 새로운 형태의 금융 서비스를 말한다.",KNIA,2025-08-14 12:21:26
125,방카슈랑스 / /,"은행과 보험의 합성어로, 기존 은행과 보험회사가 서로 연결하여 일반 개인에게 광역의 금융서비스를 제공하는 것이다. 또는 보험회사가 은행지점을 보험상품의 판매대리점으로 이용하여 은행원이 직접 보험상품을 파는 영업형태를 말하기도 한다.",DB생명,2025-08-14 13:18:54
184,방화구획,"방화구획은 다음 구조의 자립성이 있는 벽, 바닥 및 갑종방화문(자동방화셔터 포함)으로 일정공간을 구획하는 것으로서 각기 해당조건을 구비하여야 한다. (1) 벽 및 바닥 (가) 구 조: 내화구조 (나) 조 건 1 목조건물에서 방화구획을 위한 벽(방화벽)은 지붕면과 양쪽의 외벽면으로 부터 50이상 돌출하여야 한다. 2 풍도(환기, 냉*난방용 등의 닥트)가 방화구획을 관통하는 경우에는 관통부에 자동방화댐퍼(주1)를 설치하여야 한다.",KNIA,2025-08-14 12:21:26
109,배당금,"보험계약자로 부터 받은 보험료로 보험회사를 효율적으로 운영해 발생한 이익금을 배당금이라 한다. 배당금은 사차익, 이차익, 비차익에서 발생되며, 지급방법은 적립,보험료에서 상계, 현급지급방법이 있다.",한화생명,2025-08-14 14:29:51
126,배당금 / /,보험계약자로부터 납입된 보험료를 가지고 보험회사가 합리적인 경영을 행하여 발생한 이익금 중 보험계약자에게 환원하여주는 금액을 배당금이라 한다. 이익금의 3대 이원으로는 1위험률차익 2이자율차익 3사업비차익이 있다. 배당금의 지급방법은 1적립방법 2상계방법 3현금지급방법이 있다.,DB생명,2025-08-14 13:18:54
368,배당금지급방법(,"이익배당부생명보험계약에서 보험계약자에게 배당금을 분배하는 방법을 말한다. 1보험료와 상계하는 방법(보험료상계배당방식) 2이자를 붙여서 적립하는 방법(적립배당방식) 3보험가입금액을 늘이는 방법(보험금증액방식) 4현금으로 지급하는 방법 등이 있다. 1은 계약상 당일에 시작되는 보험연도에 대해서, 배당금을 보험료납입 회수로 등분하여 매회의 보험료에 충당상계하는 방법이다. 배당금이 보험료를 웃도는 경우에는 그 웃도는 액수를 현금으로 지급하거나 이자를 붙여서 적립한다. 2는 매년 배당금을 계약상 당일부터 이자를 붙여서 회사에 적립해 두고, 계약이 소멸될 때나 청구가 있을 때에 적립배당금을 지급하는 방법이다. 보험료 지급의 필요가 없어진 계약(일시납, 완납, 연장보험 등)에 대해서는 이 방법이 쓰여진다. 3은 배당금을 일시납보험료로 해서 계약상 당일에 보험가입금액을 늘이는 방법이다.",KIDI_BIGIN,2025-08-13 17:22:57
369,배당부보험,"사망률 ̇이율 ̇사업비율이라는 보험료 계산의 3요소에 상당한 안전율을 가미함으로써, 실제의 필요액을 초과한 액수가 생기는데 이것이 계약자배당으로 계약자에게 환급되는 보험. 저보험료주의의 무배당보험에 비해서 계산요소의 변동에 대하여 보다 큰 탄력성을 가지고 있다. 배당부보험에서는 납입보험료에서 배당금을 공제한 금액이 순부금이 된다.",KIDI_BIGIN,2025-08-13 17:22:57
124,배당부보험,"사망율, 이율, 사업비율이라는 보험료 계산에 3요소에 상당한 안전율을 가미함으로써, 실제의 필요액을 초과한 액수가 생기는데 이것이 계약자배당으로 계약자에게 환급되는 보험. 저보험료주의의 무배당보험에 비해서 계산요소의 변동에 대하여 보다 큰 탄력성을 가지고 있다. 배당부보험에서는 납입보험료에서 배당금을 공제한 금액이 순부금이 된다.~~~~사망율, 이율, 사업비율이라는 보험료 계산에 3요소에 상당한 안전율을 가미함으로써, 실제의 필요액을 초과한 액수가 생기는데 이것이 계약자배당으로 계약자에게 환급되는 보험. 저보험료주의의 무배당보험에 비해서 계산요소의 변동에 대하여 보다 큰 탄력성을 가지고 있다. 배당부보험에서는 납입보험료에서 배당금을 공제한 금액이 순부금이 된다.",한화생명,2025-08-14 14:29:51
185,배당적립금,"각 사업년도말에 해당상품 자산의 실제운용수익이 예정수익을 초과하는 경우 그 초과 범위 내에서 금융감독원장이 정하는 방법에 따라 계산한 금액 * 발생시기 : 유배당상품 또는 연금상품의 보험년도 말 발생 * 지급시기 : 금액 발생시, 계약의 해지, 이재소멸, 연금 지급시",KNIA,2025-08-14 12:21:26
370,배당준비금,보험업법에서 규정한 책임준비금의 하나로서 이익배당생명보험에서 약관 및 사업방법서에서 정한 확정배당금과 이익배당금을 보험계약자에게 배당하기 위하여 적립하는 준비금. 확정배당준비금 이익배당,KIDI_BIGIN,2025-08-13 17:22:57
127,배당준비금 / /,보험업법에서 규정한 책임준비금의 하나로서 이익배당생명보험에서 약관 및 사업방법서에서 정한 확정배당금과 이익배당금을 보험계약자에게 배당하기 위하여 적립하는 준비금,DB생명,2025-08-14 13:18:54
186,배상의무자,1 자동차상해. 가족상해에서의 배상의무란 피보험자를 죽게하거나 다치게 함으로써 피보험자에게 입힌 손해에 대하여 법률상 손해배상책임을 지는 사람을 말한다. 2 무보험자동차에 의한 상해에서의 배상의무자란 무보험자동차의 사고로 인하여 피보험자를 죽게 하거나 다치게 함으로써 피보험자에게 입힌손해에 대하여 법률상 손해배상책임을 지는 사람을 말한다,KNIA,2025-08-14 12:21:26
187,배상책임,보험증권상의 보장지역 내에서 보험기간 중에 발생된 보험사고로 인하여 타인에게 입힌손해에 대한 법률상의 책임을 말합니다.,KNIA,2025-08-14 12:21:26
371,배상책임보험,"배상책임보험은 일상생활이나 사업활동중의 과실로 타인의 신체나 재물에 손해를 끼친 법률상의 손해배상책임을 부담하게 되어 발생하는 피보험자의 손해를 보상하는 보험이다. 따라서 배상책임보험은 법률상의 손해배상금, 소송비용, 변호사 보수, 중재 또는 화해비용, 응급비용, 호송 또는 기타 긴급조치에 소요된 비용 등을 보상한다. 이 보험은 가해자측의 손해배상에 따르는 경제적 파탄을 구제하고 손해배상책임의 확실한 이행을 촉진시켜 간접적으로 피해자를 구제하는 기능을 가지고 있다. 배상책임보험의 종류는 1 종합대상의 배상책임보험 즉, 해상보험, 자동차보험, 항공보험, 원자력보험 등과 관련한 손해배상책임등 부보대상으로 한다. 2 단독대상의 배상책임보험은 여객상해배상책임보험, 노동자재해배상책임보험 및 노동재해사용자배상책임보험이 있으며, 3 일반적배상책임보험으로는 기업배상책임보험, 개인배상책임보험, 전문직업인배상책임보험과 건축사 및 기사 전문직업 전문인배상책임보험이 있다. 이들은 별종의 보험으로서 운영되거나 각종 특별약관으로 인수하고 있다.",KIDI_BIGIN,2025-08-13 17:22:57
188,배상책임보험,"배상책임보험은 일상생활이나 사업활동중의 과실로 타인의 신체나 재물에 손해를 끼친 법률상의 손해배상책임을 부담하게 되어 발생하는 피보험자의 손해를 보상하는 보험이다. 따라서 배상책임보험은 법률상의 손해배상금, 소송비용, 변호사 보수, 중재 또는 화해비용, 응급비용, 호송 또는 기타 긴급조치에 소요된 비용 등을 보상한다. 이 보험은 가해자측의 손해배상에 따르는 경제적 파탄을 구제하고 손해배상책임의 확실한 이행을 촉진시켜 간접적으로 피해자를 구제하는 기능을 가지고 있다. 배상책임보험의 종류에는 영업배상책임보험 등 일반배상책임보험, 전문직업배상책임보험, 근로자재해보장책임보험, 자동차보험의 대인배상 및 대물배상책임 등이 있다. 배상책임보험 중에는 자동차보험의 대인 및 대물배상책임, 가스사고배상책임보험 등 관련법률에 의해 가입이 강제되는 의무보험과 가입자가 임의로 선택하여 가입할 수 있는 임의보험이 있다.",KNIA,2025-08-14 12:21:26
128,배상책임보험 / /,"배상책임보험은 일상생활이나 사업활동중의 과실로 타인의 신체나 재물에 손해를 끼쳐 법률상의 손해배상책임을 부담하는 피보험자의 손해를 보상하는 보험이다. 따라서 배상책임보험은 법률상의 손해배상금, 소송비용, 변호사, 보수, 중재 또는 화해비용, 응급비용, 호송 또는 기타 긴급조치에 소요된 비용 등을 보상한다. 이 보험은 가해자측의 손해배상에 따르는 경제적 파탄을 구제하고 손해배상책임의 확실한 이행을 촉진시켜 간접적으로 피해자를 구제하는 기능을 가지고 있다.",DB생명,2025-08-14 13:18:54
372,배서,"보험증권 등의 배(이)면에 첨부하는 특별조항을 말하며 보험자가 보험증권 기재사항의 정정, 추가, 통지의 확인 등을 위하여 보험증권에 필요한 내용을 기재하는 것이 보통형식이나 해상적하보험증권과 같이 보험증권을 양도할 목적으로 피보험자가 서명하는 것도 배서라고 한다.",KIDI_BIGIN,2025-08-13 17:22:57
373,배액지급,"생명보험에서 보험금의 일정배수, 예컨데 5배의 금액을 지급하는 것을 말한다. 흔히 재해배액지급특약으로 주계약에 붙여서, 특정의 재해사망시에 배액보험금을 지급하는 형태를 취한다. 또 생존보험 1 ̇정기보험 2의 배합에 의해서 보통사망시에 만기시의 배액을 지급하는 배액보장보험도 있다. 미국에서는 일반적으로 종신보험에 일정기간 동액의 정기보험을 부가하는 유형을 배액보장보험이라고 부른다.",KIDI_BIGIN,2025-08-13 17:22:58
110,배액지급,"생명보험에서 보험금의 일정배수, 예컨대 5배의 금액을 지급하는 것을 말한다. 흔히 재해배액지급특약으로 주계약에 붙여서, 특정의 재해사망시에 배액보험금을 지급하는 형태를 취한다. 또 생존보험 1, 정기 보험 2의 배합에 의해서 보통사망시에 만기시의 배액을 지급하는 배액보장보험도 있다. 미국에서는 일반적으로 종신보험에 일정기간 동액의 정기보험을 부가하는 유형을 배액보장보험이라고 부른다.",한화생명,2025-08-14 14:29:51
374,백만불원탁회의,"미국의 생명보험단체인 전미생명보험업자협회의 한 기구로서 1927년에 설립되었다. 연간의 신계약거수실적 100만불 이상의 모집인을 표창하기 위하여 설립된 제도이며, 이것을 「백만불원탁회의」라고 부른다. 백퍼센트 분손 100% 전손 ̇수리비용 및 손해방지비용을 지급의 대상으로 하는 선박보험계약에 있어서 보험사고에 의한 공동해손분담액 또는 손해방지비용의 각 견적액 및 수리비용의 합계액이 보험가액을 초과하는 경우에도 피보험자는 전손금을 청구하지 않고, 피보험선박을 구조 ̇수리한 후에 보험금액의 전액을 분손보험금으로서 청구할 수 있다. 이것을 100% 분손이라고 한다. 전손의 경우와 달리 100% 분손의 경우 소유권 등의 이전없이 예정된 보험기간의 만료까지 보험계약이 유지된다.",KIDI_BIGIN,2025-08-13 17:22:58
129,백만불원탁회의 / /,"미국의 생명단체인 전미생명보험업자협회의 한 기구로서 1927년에 설립되었다. 연간 신계약거수실적 100만불 이상의 모집인을 표창하기 위하여 설립된 제도이며, 이것을 「백만불원탁회의」라고 부른다.",DB생명,2025-08-14 13:18:54
190,백악질 [영 : ],"치근의 표면을 덮고 있어 치아를 치조골에 고정시키는 역할을 하며 골조직보다는 단단하고 법랑질보다는 강도가 약한 벽색의 약간 불투명한 층이며, 시멘트질이라고도 한다.",KNIA,2025-08-14 12:21:26
375,범위요율,"표준이 되는 보험요율을 중심으로, 예컨데 100분의 10이내의 인상과 인하를 인정하는 제도를 말한다. 범위요율은 위험의 변동 ̇실태에 상응한 요율을 적용할 수 있는 여지를 마련함으로써, 협정요율 내지 고정요율의 경직화를 막으려는 취지에서 도입되었다.",KIDI_BIGIN,2025-08-13 17:22:58
130,범위요율 / /,"표준이 되는 보험요율을 중심으로, 예컨대 100분의 10이내의 인상과 인하를 인정하는 제도를 말한다. 범위요율은 위험의 변동·실태에 상응한 요율을 적용할 수 있는 여지를 마련함으로써, 협정요율 내지 고정요율의 경직화를 막으려는 취지에서 도입되었다.",DB생명,2025-08-14 13:18:54
